{
  "$schema": "http://json-schema.org/draft-07/schema#",
  "title": "Repository Analysis Output",
  "type": "object",
  "properties": {
    "repo_url": { "type": "string" },
    "ref": { "type": "string" },
    "timestamp": { "type": "string", "format": "date-time" },
    "metadata": {
      "type": "object",
      "properties": {
        "owner": { "type": "string" },
        "repo": { "type": "string" }
      }
    },
    "scores": {
      "type": "object",
      "properties": {
        "quality": { "type": "integer", "minimum": 0, "maximum": 100 },
        "cloud_readiness": { "type": "integer", "minimum": 0, "maximum": 100 },
        "risk": { "type": "integer", "minimum": 0, "maximum": 100 }
      },
      "required": ["quality", "cloud_readiness", "risk"]
    },
    "signals": {
      "type": "object",
      "description": "Raw signals detected during analysis"
    },
    "findings": {
      "type": "array",
      "items": {
        "type": "object",
        "properties": {
          "id": { "type": "string" },
          "category": { "type": "string" },
          "severity": { "type": "string", "enum": ["Low", "Medium", "High"] },
          "title": { "type": "string" },
          "description": { "type": "string" },
          "evidence": { "type": "array", "items": { "type": "string" } }
        },
        "required": ["id", "category", "severity", "title"]
      }
    },
    "report_markdown": { "type": "string" }
  },
  "required": ["repo_url", "timestamp", "scores", "signals", "findings"]
}
