{
  "repo_url": "https://github.com/jgraph/drawio-mcp",
  "ref": "main",
  "timestamp": "2026-02-17T04:33:57.883059+00:00",
  "metadata": {
    "owner": "jgraph",
    "repo": "drawio-mcp",
    "stars": 427,
    "language": "JavaScript"
  },
  "scores": {
    "quality": 60,
    "cloud_readiness": 30,
    "risk": 40
  },
  "signals": {
    "has_readme": true,
    "manifests_found": [],
    "has_manifest": false,
    "has_ci": false,
    "ci_providers": [],
    "has_tests": false,
    "has_docker": false,
    "dockerfile_issues": [],
    "has_lockfile": false,
    "has_iac": false,
    "iac_providers": [],
    "potential_secrets_found": [],
    "has_secrets_smell": false
  },
  "findings": [
    {
      "id": "OPS-001",
      "category": "Operations",
      "severity": "Medium",
      "title": "Missing CI/CD Pipeline",
      "description": "No CI configuration files (GitHub Actions, Jenkins, etc.) were detected.",
      "evidence": []
    },
    {
      "id": "QUAL-001",
      "category": "Quality",
      "severity": "Medium",
      "title": "Missing Tests",
      "description": "No test directories or test files were detected.",
      "evidence": []
    }
  ],
  "report_markdown": "# Repository Analysis: https://github.com/jgraph/drawio-mcp\n**Date:** 2026-02-17T04:33:57.883059+00:00\n\n## Executive Summary\n| Metric | Score | Status |\n| :--- | :--- | :--- |\n| **Quality** | 60/100 | \ud83d\udfe1 Fair |\n| **Cloud Readiness** | 30/100 | \ud83d\udd34 Poor |\n| **Risk** | 40/100 | \ud83d\udfe1 Medium |\n\n## Key Findings\n### MF Missing CI/CD Pipeline\n**Severity:** Medium\nNo CI configuration files (GitHub Actions, Jenkins, etc.) were detected.\n\n### MF Missing Tests\n**Severity:** Medium\nNo test directories or test files were detected.\n\n## Detailed Signals\n### Hygiene & Standards\n- **README:** \u2705 Found\n- **Manifests:** None\n### CI/CD\n- **CI System:** \u274c None detected\n### Testing\n- **Tests:** \u26a0\ufe0f Not detected\n### Infrastructure & Cloud\n- **Docker:** \u26aa Not found\n- **IaC:** \u26aa None\n### Security & Risk\n- **Secrets Smell:** \u2705 Clean\n\n---\n*Generated by repo-intel-bundle-v2*"
}